meme_name,post_title,post_date,subreddit,score,num_comments,awards,url
Trollface,How my sister came to hate my husband.,2017-08-03,fatpeoplestories,636,55,0,https://reddit.com/r/fatpeoplestories/comments/6r9ivx/how_my_sister_came_to_hate_my_husband/
Trollface,Trollface is successful troll. Problem?,2010-03-07,fffffffuuuuuuuuuuuu,561,80,0,https://reddit.com/r/fffffffuuuuuuuuuuuu/comments/baf9o/trollface_is_successful_troll_problem/
Trollface,Problem speertard?,2021-09-17,RedFloodMod,445,13,0,https://reddit.com/r/RedFloodMod/comments/ppu398/problem_speertard/
Trollface,Congratulations to the winner of Two Stock Singles at Mang0.5 Summit!,2022-05-11,smashbros,441,13,0,https://reddit.com/r/smashbros/comments/un1qhv/congratulations_to_the_winner_of_two_stock/
Trollface,"Hey FFFUUUUUUUU, I got a trollface stamp made. Problem?",2010-04-18,fffffffuuuuuuuuuuuu,360,88,0,https://reddit.com/r/fffffffuuuuuuuuuuuu/comments/bshpi/hey_fffuuuuuuuu_i_got_a_trollface_stamp_made/
Trollface,I wish all of these 1000 universes would combine into one,2019-10-20,DouchebagGenie,315,95,0,https://reddit.com/r/DouchebagGenie/comments/dkidg4/i_wish_all_of_these_1000_universes_would_combine/
Trollface,Ticks off all the Elements,2022-12-12,DnDGreentext,287,17,0,https://reddit.com/r/DnDGreentext/comments/zkd4x8/ticks_off_all_the_elements/
Trollface,Homeschool Ham:Weeblyn Crashes my Movie Night,2015-07-20,fatpeoplestories,275,73,0,https://reddit.com/r/fatpeoplestories/comments/3dxwro/homeschool_hamweeblyn_crashes_my_movie_night/
Trollface,Problem? :trollface:,2022-11-06,whenthe,273,8,0,https://reddit.com/r/whenthe/comments/ynir2h/problem_trollface/
Trollface,Hololithic technology turns out to be... sorcery?,2025-08-01,40kLore,256,41,0,https://reddit.com/r/40kLore/comments/1mf47dn/hololithic_technology_turns_out_to_be_sorcery/
Trollface,[PSA] Everything Known about June Workshop Incident,2022-06-26,gmod,246,54,0,https://reddit.com/r/gmod/comments/vl9fie/psa_everything_known_about_june_workshop_incident/
Trollface,"Be advised, hardcore mode is terribly addictive.",2012-01-26,battlefield3,242,464,0,https://reddit.com/r/battlefield3/comments/ox15m/be_advised_hardcore_mode_is_terribly_addictive/
Trollface,Would anyone be interested in Troll stickers?,2010-10-27,fffffffuuuuuuuuuuuu,217,118,0,https://reddit.com/r/fffffffuuuuuuuuuuuu/comments/dxe2x/would_anyone_be_interested_in_troll_stickers/
Trollface,"Hey Nymn, I made you into trollface, problem?",2021-02-26,RedditAndChill,206,5,0,https://reddit.com/r/RedditAndChill/comments/lsuexq/hey_nymn_i_made_you_into_trollface_problem/
Trollface,Allied bomber pilots be like: Problem? *trollface*,2020-10-01,DerScheisser,183,1,0,https://reddit.com/r/DerScheisser/comments/j3b55z/allied_bomber_pilots_be_like_problem_trollface/
Trollface,"I live in the UK. In the last two years, I've been assaulted three times on nights out. All three times were by women. ",2011-06-18,MensRights,175,147,0,https://reddit.com/r/MensRights/comments/i2x6r/i_live_in_the_uk_in_the_last_two_years_ive_been/
Trollface,THE STORY OF JOE HAWLEY JOE HAWLEY:,2021-09-01,tallyhall,172,29,0,https://reddit.com/r/tallyhall/comments/pft9pq/the_story_of_joe_hawley_joe_hawley/
Trollface,[OC] Galactic code is complete garbage.,2015-07-05,HFY,160,13,0,https://reddit.com/r/HFY/comments/3c65up/oc_galactic_code_is_complete_garbage/
Trollface,Drugi put isti mem upotreblijavam? Problem?????? :trollface: 😂😂😂😂😲😲😲😲,2020-11-22,okbuddyHRetard,155,12,0,https://reddit.com/r/okbuddyHRetard/comments/jyxw0m/drugi_put_isti_mem_upotreblijavam_problem/
Nyan Cat,"I'm the original artist behind the Nyan Cat image and think Dogecoin is neat, so I drew this cutie today. To the moon!",2021-02-08,dogecoin,73540,1153,0,https://reddit.com/r/dogecoin/comments/lf0vx9/im_the_original_artist_behind_the_nyan_cat_image/
Nyan Cat,I can’t even imagine how happy their owner is after seeing this.,2023-10-11,MadeMeSmile,63355,733,0,https://reddit.com/r/MadeMeSmile/comments/175j8uk/i_cant_even_imagine_how_happy_their_owner_is/
Nyan Cat,My baby boy Dwight turned 18 years old today. 🥺,2024-11-18,standardissuecat,53193,1248,0,https://reddit.com/r/standardissuecat/comments/1guha6j/my_baby_boy_dwight_turned_18_years_old_today/
Nyan Cat,I lost my beautiful boy this morning so I wanted to share him with you all.,2025-03-03,cats,44449,1419,0,https://reddit.com/r/cats/comments/1j2pocf/i_lost_my_beautiful_boy_this_morning_so_i_wanted/
Nyan Cat,This crochet rainbow barf cat scarf (by Amanda Julien),2020-03-18,interestingasfuck,37980,246,0,https://reddit.com/r/interestingasfuck/comments/fksgpk/this_crochet_rainbow_barf_cat_scarf_by_amanda/
Nyan Cat,PsBattle: Hairless cat in a rainbow sweater.,2018-04-16,photoshopbattles,36196,481,0,https://reddit.com/r/photoshopbattles/comments/8cokd2/psbattle_hairless_cat_in_a_rainbow_sweater/
Nyan Cat,PsBattle: This rainbow cat,2019-01-17,photoshopbattles,36140,307,0,https://reddit.com/r/photoshopbattles/comments/ah18qn/psbattle_this_rainbow_cat/
Nyan Cat,May I serve you some nyan cat?,2020-09-09,memes,33038,78,0,https://reddit.com/r/memes/comments/ipd05o/may_i_serve_you_some_nyan_cat/
Nyan Cat,Ribbon [OC],2025-09-16,comics,32080,608,0,https://reddit.com/r/comics/comments/1nipm5z/ribbon_oc/
Nyan Cat,Rainbow cat the destroyer of beams,2021-07-01,Bossfight,30299,216,0,https://reddit.com/r/Bossfight/comments/obkc4x/rainbow_cat_the_destroyer_of_beams/
Nyan Cat,It feels weird making a meme about nyan cat,2020-05-27,memes,27984,45,0,https://reddit.com/r/memes/comments/grlp10/it_feels_weird_making_a_meme_about_nyan_cat/
Nyan Cat,When developers truly cared about their fans,2025-09-08,MadeMeSmile,27224,95,0,https://reddit.com/r/MadeMeSmile/comments/1nbwi8l/when_developers_truly_cared_about_their_fans/
Nyan Cat,Back in my day we laughed at flying space cat poptarts that farted out rainbows!,2021-03-28,dankmemes,27085,134,0,https://reddit.com/r/dankmemes/comments/mf85u0/back_in_my_day_we_laughed_at_flying_space_cat/
Nyan Cat,This rainbow cat,2021-02-05,oddlysatisfying,25832,246,0,https://reddit.com/r/oddlysatisfying/comments/ldgb7q/this_rainbow_cat/
Nyan Cat,"You've been visited by a rainbow cat, your luck has been increased.",2020-06-17,aww,25262,164,0,https://reddit.com/r/aww/comments/haruog/youve_been_visited_by_a_rainbow_cat_your_luck_has/
Nyan Cat,110 reasons to NOT commit suicide,2020-09-27,copypasta,23234,1341,0,https://reddit.com/r/copypasta/comments/j0ku0m/110_reasons_to_not_commit_suicide/
Nyan Cat,I told my (rainbow Bridge) cat that I'd take a new cat if he sent me one,2026-02-03,CatDistributionSystem,22728,326,0,https://reddit.com/r/CatDistributionSystem/comments/1qudnj5/i_told_my_rainbow_bridge_cat_that_id_take_a_new/
Nyan Cat,Woke Up To My Cat Laying Just Purrfectly Where My Light Catcher Was Shining A Rainbow [OC],2022-06-02,pics,22677,251,0,https://reddit.com/r/pics/comments/v398u9/woke_up_to_my_cat_laying_just_purrfectly_where_my/
Nyan Cat,Rainbow cat,2020-01-29,aww,21804,120,0,https://reddit.com/r/aww/comments/evpdqo/rainbow_cat/
Nyan Cat,"My first ever meme, so forgive me if it's bad. A Crochet Rainbow Barf Cat Plush Scarf (credit: Amanda Julien)",2020-10-18,memes,21646,207,0,https://reddit.com/r/memes/comments/jdjqid/my_first_ever_meme_so_forgive_me_if_its_bad_a/
Nyan Cat,"A Tribute to Maru, one of YouTube’s Most Famous Cats. He crossed over the Rainbow Bridge on Sept. 6th at age 18",2025-09-07,cats,21094,488,0,https://reddit.com/r/cats/comments/1nayubz/a_tribute_to_maru_one_of_youtubes_most_famous/
Nyan Cat,I will never stop crying about this one thing the cat did. She really hated me.,2025-01-12,cats,19932,207,0,https://reddit.com/r/cats/comments/1hzoq5m/i_will_never_stop_crying_about_this_one_thing_the/
Nyan Cat,PsBattle: Cat on floor with rainbow,2021-07-05,photoshopbattles,19587,213,0,https://reddit.com/r/photoshopbattles/comments/oe1ipd/psbattle_cat_on_floor_with_rainbow/
Nyan Cat,They can’t even fit on the page anymore.,2023-01-24,tumblr,19355,147,0,https://reddit.com/r/tumblr/comments/10jxyc5/they_cant_even_fit_on_the_page_anymore/
Nyan Cat,My cat had a rainbow shining into one of her eyes that changed the color of her eye,2016-02-18,mildlyinteresting,18532,418,0,https://reddit.com/r/mildlyinteresting/comments/46gd2p/my_cat_had_a_rainbow_shining_into_one_of_her_eyes/
Rickroll,📣 Apollo will close down on June 30th. Reddit’s recent decisions and actions have unfortunately made it impossible for Apollo to continue. Thank you s,2023-06-08,apolloapp,221159,15247,0,https://reddit.com/r/apolloapp/comments/144f6xm/apollo_will_close_down_on_june_30th_reddits/
Rickroll,We need your voice as we continue the fight for net neutrality,2017-07-12,blog,195550,8883,0,https://reddit.com/r/blog/comments/6mtgtp/we_need_your_voice_as_we_continue_the_fight_for/
Rickroll,"LPT: keep your mouth shut, and don't volunteer information",2020-02-19,LifeProTips,192097,5385,0,https://reddit.com/r/LifeProTips/comments/f6jt5e/lpt_keep_your_mouth_shut_and_dont_volunteer/
Rickroll,TIFU / My (20F) girlfriend of two years told me the music that I (25M) play during sex is weird and a major turn off,2022-09-01,tifu,183757,4963,0,https://reddit.com/r/tifu/comments/x35iu6/tifu_my_20f_girlfriend_of_two_years_told_me_the/
Rickroll,Never gonna happen,2021-02-27,memes,147217,2558,0,https://reddit.com/r/memes/comments/ltjdhl/never_gonna_happen/
Rickroll,Never give up,2018-03-06,funny,137169,1390,0,https://reddit.com/r/funny/comments/82i32u/never_give_up/
Rickroll,TIL that Billy Joel never sells front row seats in order to see the real fans right in front of him. He gives them away to random people in the cheap ,2017-06-03,todayilearned,136817,2648,0,https://reddit.com/r/todayilearned/comments/6f13fz/til_that_billy_joel_never_sells_front_row_seats/
Rickroll,"Roughly the first five seconds of ""Never Gonna Give You Up"" is now a silent Sony Music title card that displays copyright and licensing information, e",2020-12-09,videos,136326,4762,0,https://reddit.com/r/videos/comments/k9iqgk/roughly_the_first_five_seconds_of_never_gonna/
Rickroll,"📣 I want to debunk Reddit's claims, and talk about their unwillingness to work with developers, moderators, and the larger community, as well as say t",2023-06-19,apolloapp,134032,5397,0,https://reddit.com/r/apolloapp/comments/14dkqrw/i_want_to_debunk_reddits_claims_and_talk_about/
Rickroll,Young skater never gives up trying to pull off a sick trick,2024-08-18,nextfuckinglevel,131588,1558,0,https://reddit.com/r/nextfuckinglevel/comments/1evn7xw/young_skater_never_gives_up_trying_to_pull_off_a/
Rickroll,"(OC) Overweight since childhood - no energy, no motivation, and a growing pile of health issues until I decided to make a change ",2024-08-30,BeAmazed,129783,2913,0,https://reddit.com/r/BeAmazed/comments/1f4z6s8/oc_overweight_since_childhood_no_energy_no/
Rickroll,TIFU by lying to my wife for 13 years…,2022-01-14,tifu,127475,3921,0,https://reddit.com/r/tifu/comments/s3f513/tifu_by_lying_to_my_wife_for_13_years/
Rickroll,Chad was never gonna make it,2021-03-02,memes,124915,889,0,https://reddit.com/r/memes/comments/lw275a/chad_was_never_gonna_make_it/
Rickroll,"I made my boss over $1.5 million in commission over two years, while I made $45k/year. For Christmas he got me a $25 gift card to a movie theater chai",2022-01-11,antiwork,123820,4819,0,https://reddit.com/r/antiwork/comments/s1deoh/i_made_my_boss_over_15_million_in_commission_over/
Rickroll,Never give up on your goals.,2020-10-22,nextfuckinglevel,120451,975,0,https://reddit.com/r/nextfuckinglevel/comments/jg7ha0/never_give_up_on_your_goals/
Rickroll,"""No nation older than 250 years""",2025-01-24,confidentlyincorrect,119836,3922,0,https://reddit.com/r/confidentlyincorrect/comments/1i8w9gg/no_nation_older_than_250_years/
Rickroll,Such a nice guy!,2024-12-18,BeAmazed,118865,1820,0,https://reddit.com/r/BeAmazed/comments/1hgxodp/such_a_nice_guy/
Rickroll,"[OC] It's been nearly 4 years since I was diagnosed with Stage IV cancer. As of Feb 22nd 2023, I'm Cancer free!!! The pic on the left is in Nov 2019, ",2023-06-23,MadeMeSmile,117058,1475,0,https://reddit.com/r/MadeMeSmile/comments/14gqil6/oc_its_been_nearly_4_years_since_i_was_diagnosed/
Rickroll,Rick Astley - Never Gonna Give You Up sped up every time he says Never,2016-12-03,videos,116992,5679,0,https://reddit.com/r/videos/comments/5gafop/rick_astley_never_gonna_give_you_up_sped_up_every/
Rickroll,An Open Letter to the Reddit Community,2017-01-30,blog,115840,30170,0,https://reddit.com/r/blog/comments/5r43td/an_open_letter_to_the_reddit_community/
Rickroll,Dying Before April: My Endgame,2019-01-05,marvelstudios,114889,3933,0,https://reddit.com/r/marvelstudios/comments/actrm0/dying_before_april_my_endgame/
Rickroll,My own headstone,2025-03-23,CemeteryPorn,114413,3485,0,https://reddit.com/r/CemeteryPorn/comments/1jht0oh/my_own_headstone/
Rickroll,She never gonna take photo after this,2025-03-11,Unexpected,112399,627,0,https://reddit.com/r/Unexpected/comments/1j8lss4/she_never_gonna_take_photo_after_this/
Rickroll,Meirl,2026-01-19,meirl,110262,3180,0,https://reddit.com/r/meirl/comments/1qh5gel/meirl/
Rickroll,Never give up!,2021-08-14,MadeMeSmile,108004,506,0,https://reddit.com/r/MadeMeSmile/comments/p4e7xt/never_give_up/
Surprised Pikachu,📣 Apollo will close down on June 30th. Reddit’s recent decisions and actions have unfortunately made it impossible for Apollo to continue. Thank you s,2023-06-08,apolloapp,221157,15247,0,https://reddit.com/r/apolloapp/comments/144f6xm/apollo_will_close_down_on_june_30th_reddits/
Surprised Pikachu,Megathread: House Votes to Impeach President Donald J. Trump for Incitement of Insurrection,2021-01-13,politics,116249,31235,0,https://reddit.com/r/politics/comments/kwqdsf/megathread_house_votes_to_impeach_president/
Surprised Pikachu,Shocked_Pikachu_Face.jpeg,2020-06-27,MurderedByWords,91566,2308,0,https://reddit.com/r/MurderedByWords/comments/hgnrd1/shocked_pikachu_facejpeg/
Surprised Pikachu,This deaf ferret has the cutest surprise face,2020-08-05,TikTokCringe,90773,864,0,https://reddit.com/r/TikTokCringe/comments/i3vn4g/this_deaf_ferret_has_the_cutest_surprise_face/
Surprised Pikachu,"Megathread: US Capitol Locked Down as Trump Supporters Clash with Police, Pence Evacuated",2021-01-06,politics,86739,88020,0,https://reddit.com/r/politics/comments/krvh1f/megathread_us_capitol_locked_down_as_trump/
Surprised Pikachu,Sudden realization ,2024-12-09,KidsAreFuckingStupid,84559,280,0,https://reddit.com/r/KidsAreFuckingStupid/comments/1ha91kv/sudden_realization/
Surprised Pikachu,Care workers surprise 94 year old veteran with a pillow of his wife's face after seeing he slept next to her photograph,2023-08-25,MadeMeSmile,81800,1258,0,https://reddit.com/r/MadeMeSmile/comments/160ty81/care_workers_surprise_94_year_old_veteran_with_a/
Surprised Pikachu,*surprised pikachu face*,2019-03-09,gifs,80730,412,0,https://reddit.com/r/gifs/comments/az6d66/surprised_pikachu_face/
Surprised Pikachu,TIFU by giving my son permission to beat his bully’s ass.,2019-06-02,tifu,75989,4887,0,https://reddit.com/r/tifu/comments/bvu086/tifu_by_giving_my_son_permission_to_beat_his/
Surprised Pikachu,The news out of Minnesota is horrifying and just the beginning.,2025-06-14,BlackPeopleTwitter,75474,841,0,https://reddit.com/r/BlackPeopleTwitter/comments/1lbcd9w/the_news_out_of_minnesota_is_horrifying_and_just/
Surprised Pikachu,Megathread: Trump Indicted by Federal Prosecutors on Charges Related to Handling of Classified Documents,2023-06-08,politics,75198,21326,0,https://reddit.com/r/politics/comments/144pdan/megathread_trump_indicted_by_federal_prosecutors/
Surprised Pikachu,Am I overreacting after I found out my boyfriend’s online “friend group” I became part of 2 years ago has been JUST him the whole time? ,2024-12-30,AmIOverreacting,73785,6913,0,https://reddit.com/r/AmIOverreacting/comments/1hpi0kl/am_i_overreacting_after_i_found_out_my_boyfriends/
Surprised Pikachu,"[Theory] Jar Jar Binks was a trained Force user, knowing Sith collaborator, and will play a central role in The Force Awakens",2015-10-30,StarWars,73294,8272,0,https://reddit.com/r/StarWars/comments/3qvj6w/theory_jar_jar_binks_was_a_trained_force_user/
Surprised Pikachu,TIFU by chilling at my friend's place while she wasn't home,2019-06-08,tifu,71849,1425,0,https://reddit.com/r/tifu/comments/by23vn/tifu_by_chilling_at_my_friends_place_while_she/
Surprised Pikachu,My wife has been peeking at me from around corners and behind furniture. It's gone from weird to terrifying,2022-02-18,nosleep,70315,1259,0,https://reddit.com/r/nosleep/comments/sva7z6/my_wife_has_been_peeking_at_me_from_around/
Surprised Pikachu,Megathread: Michael Cohen pleads guilty to lying to Congress about Trump real estate project in Russia,2018-11-29,politics,67766,14196,0,https://reddit.com/r/politics/comments/a1htyo/megathread_michael_cohen_pleads_guilty_to_lying/
Surprised Pikachu,"41yo suboxone patient with lung cancer. I don't mean to keep pestering this sub, but I thought I'd drop in to say good-bye. The cancer is in my heart ",2020-11-14,AskDocs,66979,5817,0,https://reddit.com/r/AskDocs/comments/ju4mua/41yo_suboxone_patient_with_lung_cancer_i_dont/
Surprised Pikachu,Surprised Pikachu :O,2022-04-19,dankmemes,65063,1249,0,https://reddit.com/r/dankmemes/comments/u7hbtk/surprised_pikachu_o/
Surprised Pikachu,"A woman got a delightful surprise when her sister, a professional makeup artist, transformed her Frenchie Bulldog into a Siberian white tiger. She use",2019-09-13,interestingasfuck,61221,470,0,https://reddit.com/r/interestingasfuck/comments/d3r61e/a_woman_got_a_delightful_surprise_when_her_sister/
Surprised Pikachu,Megathread: Intelligence report claims Russia has compromising information on Trump,2017-01-11,politics,60587,43380,0,https://reddit.com/r/politics/comments/5n8z88/megathread_intelligence_report_claims_russia_has/
Surprised Pikachu,"[UPDATE] My grandparents don’t approve of my relationship with my black boyfriend, and don’t want me (F24) to marry him (26). I don’t know what to do,",2019-09-15,relationship_advice,60052,1491,0,https://reddit.com/r/relationship_advice/comments/d4ofaz/update_my_grandparents_dont_approve_of_my/
Surprised Pikachu,"Either be fired or accept a massive pay cut. Ok, I'll take the firing.",2021-05-23,MaliciousCompliance,59922,1314,0,https://reddit.com/r/MaliciousCompliance/comments/nj7gtf/either_be_fired_or_accept_a_massive_pay_cut_ok/
Surprised Pikachu,"After a five-month search, I found two of my kidnapped friends who had been forced into marriage in China. For the past six years I've been a full-tim",2019-05-28,IAmA,59421,2720,0,https://reddit.com/r/IAmA/comments/btyjko/after_a_fivemonth_search_i_found_two_of_my/
Surprised Pikachu,Megathread: Fmr. National Security Advisor John Bolton Alleges President Trump Tied Ukraine Funding to Investigation Into Bidens,2020-01-27,politics,59113,9352,0,https://reddit.com/r/politics/comments/eugha0/megathread_fmr_national_security_advisor_john/
Surprised Pikachu,TIFU by ruining a joke my wife has been saving for years.,2019-11-03,tifu,58179,2533,0,https://reddit.com/r/tifu/comments/dr37m0/tifu_by_ruining_a_joke_my_wife_has_been_saving/
Among Us,Megathread: Joe Biden Projected to Defeat President Donald Trump and Win the 2020 US Presidential Election,2020-11-07,politics,214317,80807,0,https://reddit.com/r/politics/comments/jptq5n/megathread_joe_biden_projected_to_defeat/
Among Us,Would it make you smile if we banned all links to Twitter?,2025-01-21,MadeMeSmile,117886,7011,0,https://reddit.com/r/MadeMeSmile/comments/1i6wjra/would_it_make_you_smile_if_we_banned_all_links_to/
Among Us,Among us: How to solve a murder case 101,2020-09-17,AmongUs,114694,2037,0,https://reddit.com/r/AmongUs/comments/iupdbw/among_us_how_to_solve_a_murder_case_101/
Among Us,Megathread: Joseph R. Biden Sworn in as the 46th President of the United States,2021-01-20,politics,112126,27659,0,https://reddit.com/r/politics/comments/l1dj7s/megathread_joseph_r_biden_sworn_in_as_the_46th/
Among Us,"Professor gave me an A and it saved my life. 2.5 years later, I received this email from him.",2025-06-10,MadeMeSmile,108190,1702,0,https://reddit.com/r/MadeMeSmile/comments/1l874u7/professor_gave_me_an_a_and_it_saved_my_life_25/
Among Us,A combination of drugs touted by US president Donald Trump as an “extremely successful” Covid-19 treatment increases the chances of death among patien,2020-08-27,worldnews,96912,4018,0,https://reddit.com/r/worldnews/comments/ihosix/a_combination_of_drugs_touted_by_us_president/
Among Us,I never played Among Us. This is what I think its like. (animation by me),2020-09-15,gaming,95656,1152,0,https://reddit.com/r/gaming/comments/it1rvb/i_never_played_among_us_this_is_what_i_think_its/
Among Us,My Among Us Snow Sculpture (Took 1st Place),2021-03-09,gaming,93993,1133,0,https://reddit.com/r/gaming/comments/m1fj1h/my_among_us_snow_sculpture_took_1st_place/
Among Us,A God is walking among us,2019-02-20,Unexpected,93214,1781,0,https://reddit.com/r/Unexpected/comments/asifoe/a_god_is_walking_among_us/
Among Us,Among us is very complicated,2020-09-26,gaming,88933,739,0,https://reddit.com/r/gaming/comments/j099mw/among_us_is_very_complicated/
Among Us,"TIL the food court at Costco makes so much money selling pizza to hungry shoppers, it's ranked as the 14th largest pizza chain in the US - even beatin",2019-11-29,todayilearned,88096,3726,0,https://reddit.com/r/todayilearned/comments/e3jmv2/til_the_food_court_at_costco_makes_so_much_money/
Among Us,New plaques added to the presidential hall of fame in the White House,2025-12-17,pics,83260,15937,0,https://reddit.com/r/pics/comments/1ppatqq/new_plaques_added_to_the_presidential_hall_of/
Among Us,There is 1 reposter among us...,2020-10-23,AmongUs,80983,1477,0,https://reddit.com/r/AmongUs/comments/jgy47r/there_is_1_reposter_among_us/
Among Us,Among us - The Lion Sleeps Tonight,2020-10-19,AmongUs,79399,969,0,https://reddit.com/r/AmongUs/comments/jdzgr3/among_us_the_lion_sleeps_tonight/
Among Us,I heard u like Among us memes,2020-09-21,memes,78577,190,0,https://reddit.com/r/memes/comments/iwyd2x/i_heard_u_like_among_us_memes/
Among Us,An among us meme,2020-09-29,memes,77916,179,0,https://reddit.com/r/memes/comments/j1x0gt/an_among_us_meme/
Among Us,Impostor // an Among Us fanart I made,2020-10-09,gaming,77378,764,0,https://reddit.com/r/gaming/comments/j7zju4/impostor_an_among_us_fanart_i_made/
Among Us,Among Us phone lock screen,2020-11-11,gaming,76769,1438,0,https://reddit.com/r/gaming/comments/js54jd/among_us_phone_lock_screen/
Among Us,Making my own tabletop version of Among us!,2020-09-26,gaming,76691,1301,0,https://reddit.com/r/gaming/comments/j054kv/making_my_own_tabletop_version_of_among_us/
Among Us,The Meteoric Rise of Among Us: How a 2 year old game became viral overnight [OC],2020-09-26,dataisbeautiful,75738,2362,0,https://reddit.com/r/dataisbeautiful/comments/j08xtg/the_meteoric_rise_of_among_us_how_a_2_year_old/
Among Us,Megathread: FBI Announces They’ve Foiled a Plot to Kidnap Michigan Governor Whitmer,2020-10-08,politics,75676,14068,0,https://reddit.com/r/politics/comments/j7gppm/megathread_fbi_announces_theyve_foiled_a_plot_to/
Among Us,"Taylor Swift's private jets took 170 trips this year, landing her #1 on a new report that tracks the carbon emissions of celebrity private jets",2022-07-30,Music,73933,4563,0,https://reddit.com/r/Music/comments/wc0201/taylor_swifts_private_jets_took_170_trips_this/
Among Us,OP's teacher made an among us game,2020-11-17,AmongUs,73880,1250,0,https://reddit.com/r/AmongUs/comments/jvrrxa/ops_teacher_made_an_among_us_game/
Among Us,"After 15 years, EVE Online is having it's first $1,000,000 battle tomorrow. Here is your guide to the action.",2018-01-22,gaming,72271,5055,0,https://reddit.com/r/gaming/comments/7sa25p/after_15_years_eve_online_is_having_its_first/
Among Us,My gf made some Among Us cookies to gift this holiday season. The “imposter” cookie was made with habanero-infused butter!,2021-01-05,gaming,71109,889,0,https://reddit.com/r/gaming/comments/kr06tt/my_gf_made_some_among_us_cookies_to_gift_this/
Hide The Pain Harold,"After years of tooth pain and hiding my smile, I got dentures! They literally MadeMeSmile!",2021-09-30,MadeMeSmile,104562,2631,0,https://reddit.com/r/MadeMeSmile/comments/pyncpn/after_years_of_tooth_pain_and_hiding_my_smile_i/
Hide The Pain Harold,"Was recently told I won’t live past 35, and it’s just now hitting me",2025-05-27,Wellthatsucks,98322,2385,0,https://reddit.com/r/Wellthatsucks/comments/1kwjdos/was_recently_told_i_wont_live_past_35_and_its/
Hide The Pain Harold,TIFU by jumping into a lake in my bra/panties to save a man that turned out to be an elite military scuba diver in training,2020-06-12,tifu,93925,3539,0,https://reddit.com/r/tifu/comments/h7mzd3/tifu_by_jumping_into_a_lake_in_my_brapanties_to/
Hide The Pain Harold,My wife has been peeking at me from around corners and behind furniture. It's gone from weird to terrifying,2022-02-18,nosleep,70313,1259,0,https://reddit.com/r/nosleep/comments/sva7z6/my_wife_has_been_peeking_at_me_from_around/
Hide The Pain Harold,[OC] Today I've met Hide the Pain Harold,2022-06-26,pics,59749,925,0,https://reddit.com/r/pics/comments/vl8hzf/oc_today_ive_met_hide_the_pain_harold/
Hide The Pain Harold,"He hides the pain, he brings the pain",2018-12-08,gaming,56073,259,0,https://reddit.com/r/gaming/comments/a4ed8d/he_hides_the_pain_he_brings_the_pain/
Hide The Pain Harold,Harold the pain away,2019-12-07,dankmemes,49371,150,0,https://reddit.com/r/dankmemes/comments/e7etlw/harold_the_pain_away/
