meme_name,post_title,post_date,subreddit,score,num_comments,awards,url
Distracted Boyfriend,Jack Black walking past a couple and accidentally recreates the 'distracted boyfriend' meme,2020-06-29,pics,174433,987,0,https://reddit.com/r/pics/comments/hi2als/jack_black_walking_past_a_couple_and_accidentally/
Distracted Boyfriend,"Jack Black walks past a couple and unknowingly recreates the ""Distracted Boyfriend"" meme",2021-02-09,pics,127845,758,0,https://reddit.com/r/pics/comments/lfrv24/jack_black_walks_past_a_couple_and_unknowingly/
Distracted Boyfriend,This 1904 cartoon featuring England walking away from Germany arm in arm with France was and is the OG distracted boyfriend meme,2020-01-07,HistoryMemes,57072,574,0,https://reddit.com/r/HistoryMemes/comments/elagoo/this_1904_cartoon_featuring_england_walking_away/
Distracted Boyfriend,Way better version of distracted boyfriend meme,2025-01-21,pcmasterrace,55794,296,0,https://reddit.com/r/pcmasterrace/comments/1i6lc8l/way_better_version_of_distracted_boyfriend_meme/
Distracted Boyfriend,Distracted Boyfriend IRL ft. Jack Black,2019-02-25,youseeingthisshit,40612,285,0,https://reddit.com/r/youseeingthisshit/comments/aulynv/distracted_boyfriend_irl_ft_jack_black/
Distracted Boyfriend,Distracted Boyfriend,2018-10-01,SuddenlyGay,37043,215,0,https://reddit.com/r/SuddenlyGay/comments/9kk5sw/distracted_boyfriend/
Distracted Boyfriend,AITA for making homemade food for everyone except my brother's stepdaughter?,2023-01-31,AmItheAsshole,28077,5888,0,https://reddit.com/r/AmItheAsshole/comments/10q7zhu/aita_for_making_homemade_food_for_everyone_except/
Distracted Boyfriend,I just broke up with my boyfriend and kicked him out because he wouldn't listen to my no. I've never felt any lighter.,2021-02-14,TrueOffMyChest,26931,1327,0,https://reddit.com/r/TrueOffMyChest/comments/ljgy7e/i_just_broke_up_with_my_boyfriend_and_kicked_him/
Distracted Boyfriend,"My wife got fired, so her entire store walked",2022-05-14,antiwork,25709,1083,0,https://reddit.com/r/antiwork/comments/up6cj2/my_wife_got_fired_so_her_entire_store_walked/
Distracted Boyfriend,A cool guide to popular tourist scams,2024-08-23,coolguides,25645,2315,0,https://reddit.com/r/coolguides/comments/1ezepui/a_cool_guide_to_popular_tourist_scams/
Distracted Boyfriend,"Found on my camera roll from a 2011 Disney Trip. I give you Distracted Boyfriend Meme, prequel edition.",2021-02-25,PrequelMemes,25041,137,0,https://reddit.com/r/PrequelMemes/comments/lry33h/found_on_my_camera_roll_from_a_2011_disney_trip_i/
Distracted Boyfriend,I found the distracted boyfriend meme in Inside Out 2 (2024).,2024-08-21,MovieDetails,24027,114,0,https://reddit.com/r/MovieDetails/comments/1exsa91/i_found_the_distracted_boyfriend_meme_in_inside/
Distracted Boyfriend,Distracted boyfriend meme irl!,2024-05-03,pics,23955,707,0,https://reddit.com/r/pics/comments/1cjcazn/distracted_boyfriend_meme_irl/
Distracted Boyfriend,Am I the buttface for not letting my boyfriend be the hero while we were getting mugged at knife point?,2022-12-02,BestofRedditorUpdates,22618,1365,0,https://reddit.com/r/BestofRedditorUpdates/comments/zaeipd/am_i_the_buttface_for_not_letting_my_boyfriend_be/
Distracted Boyfriend,WIBTA for taking my friend's ex as my date to her wedding after I got kicked out of her wedding party?,2019-12-27,AmItheAsshole,22103,3426,0,https://reddit.com/r/AmItheAsshole/comments/eg8hdn/wibta_for_taking_my_friends_ex_as_my_date_to_her/
Distracted Boyfriend,"Distracted Boyfriend meme is sexist, rules Swedish ad watchdog",2018-09-26,nottheonion,20957,1694,0,https://reddit.com/r/nottheonion/comments/9j1ats/distracted_boyfriend_meme_is_sexist_rules_swedish/
Distracted Boyfriend,[Update] I suspect my (31f) new boyfriend (32m) may be ftm transgender,2020-08-09,relationship_advice,20515,188,0,https://reddit.com/r/relationship_advice/comments/i6o2sk/update_i_suspect_my_31f_new_boyfriend_32m_may_be/
Distracted Boyfriend,"AITA - I moved for my husband's job, my kids now hate me",2019-05-29,AmItheAsshole,18692,4185,0,https://reddit.com/r/AmItheAsshole/comments/buiasv/aita_i_moved_for_my_husbands_job_my_kids_now_hate/
Distracted Boyfriend,📡📡📡,2025-10-07,shitposting,18339,174,0,https://reddit.com/r/shitposting/comments/1o0by1d/_/
Distracted Boyfriend,Anyone else notice that Rockstar recreated the distracted boyfriend meme in the game?,2018-12-01,reddeadredemption,18226,212,0,https://reddit.com/r/reddeadredemption/comments/a22yy5/anyone_else_notice_that_rockstar_recreated_the/
Distracted Boyfriend,The previous tenant of my new flat left a survival guide. I think I’m going to need more than a guide.,2019-07-27,nosleep,18007,312,0,https://reddit.com/r/nosleep/comments/cinu8u/the_previous_tenant_of_my_new_flat_left_a/
Distracted Boyfriend,The original “distracted boyfriend” meme,2020-06-13,trippinthroughtime,17805,104,0,https://reddit.com/r/trippinthroughtime/comments/h8e2xf/the_original_distracted_boyfriend_meme/
Distracted Boyfriend,I finally told my father's infantilizing friend that I hate him (New Update),2024-09-18,BestofRedditorUpdates,16775,682,0,https://reddit.com/r/BestofRedditorUpdates/comments/1fjjzvs/i_finally_told_my_fathers_infantilizing_friend/
Distracted Boyfriend,Last night highlighted the difference between flirting and creepy,2018-10-11,TwoXChromosomes,16129,1756,0,https://reddit.com/r/TwoXChromosomes/comments/9naqeh/last_night_highlighted_the_difference_between/
Distracted Boyfriend,AITAH for telling my dad I'm glad he's dying of cancer after his wife convinced him to disown me for being gay,2024-08-23,AITAH,15908,3351,0,https://reddit.com/r/AITAH/comments/1ez8f76/aitah_for_telling_my_dad_im_glad_hes_dying_of/
Doge,MEGATHRED - Dogecoin Daily discussion,2021-01-28,dogecoin,33409,94534,0,https://reddit.com/r/dogecoin/comments/l79l0p/megathred_dogecoin_daily_discussion/
Doge,HOW TO BUY DOGECOIN,2021-01-29,dogecoin,30806,33488,0,https://reddit.com/r/dogecoin/comments/l87wcr/how_to_buy_dogecoin/
Doge,"True value - an open letter from Billy Markus, co-founder and original creator of Dogecoin",2021-02-08,dogecoin,28437,1644,0,https://reddit.com/r/dogecoin/comments/lfl5iz/true_value_an_open_letter_from_billy_markus/
Doge,[OC] The Price of Dogecoin $DOGE Since 2020 in 34 seconds.,2021-05-04,dataisbeautiful,23984,1565,0,https://reddit.com/r/dataisbeautiful/comments/n4dzu7/oc_the_price_of_dogecoin_doge_since_2020_in_34/
Doge,Kabosu dies: Shiba inu which inspired the 'doge' meme and became face of Dogecoin has died,2024-05-24,news,23708,542,0,https://reddit.com/r/news/comments/1czfggy/kabosu_dies_shiba_inu_which_inspired_the_doge/
Doge,i made a bunch of physical dogecoins and want to give them away to the fellow members of the doge community!,2021-05-29,dogecoin,21020,1684,0,https://reddit.com/r/dogecoin/comments/nny218/i_made_a_bunch_of_physical_dogecoins_and_want_to/
Doge,"People That Say ""Imagine If DogeCoin Went to $10 or $100"" Do You Guys Understand Market Cap and Circulating Supply? Dogecoin Price/Market Cap/Circulat",2021-04-23,CryptoCurrency,20848,3234,0,https://reddit.com/r/CryptoCurrency/comments/mwwffa/people_that_say_imagine_if_dogecoin_went_to_10_or/
Doge,DogeCoin Goals! This is our future!,2021-05-06,dogecoin,18716,1000,0,https://reddit.com/r/dogecoin/comments/n64gvk/dogecoin_goals_this_is_our_future/
Doge,"DOGE financed Napoleon’s back surgery. Thank you /r/dogecoin! To celebrate, I’m buying the dip and hodling",2021-02-15,dogecoin,18131,387,0,https://reddit.com/r/dogecoin/comments/lkbkb9/doge_financed_napoleons_back_surgery_thank_you/
Doge,Hey guys I just hit over $2 Million Dollars with my Dogecoin 😳😳😳😳🐕💎🚀🌝 @ProTheDoge,2021-05-04,dogecoin,17644,1693,0,https://reddit.com/r/dogecoin/comments/n4nadl/hey_guys_i_just_hit_over_2_million_dollars_with/
Doge,Coffeezilla YouTube channel just got deleted by YouTube for a video where he warned viewers about DogeCoin,2021-05-06,CryptoCurrency,16533,2029,0,https://reddit.com/r/CryptoCurrency/comments/n66se9/coffeezilla_youtube_channel_just_got_deleted_by/
Doge,"For the newcomers: the top 50 Cryptocurrencies, each explained with one sentence.",2021-02-09,CryptoCurrency,14814,1580,0,https://reddit.com/r/CryptoCurrency/comments/lg1yhv/for_the_newcomers_the_top_50_cryptocurrencies/
Doge,Whale activity,2021-05-05,dogecoin,13912,1319,0,https://reddit.com/r/dogecoin/comments/n5j585/whale_activity/
Doge,HOW TO BUY DOGECOIN,2021-04-17,dogecoin,13571,15666,0,https://reddit.com/r/dogecoin/comments/msp3e9/how_to_buy_dogecoin/
Doge,goodboye clasification,2017-03-09,rarepuppers,13465,298,0,https://reddit.com/r/rarepuppers/comments/5yfmpa/goodboye_clasification/
Doge,The first Doge emerges deep from within the DogeCoin mines (2013),2021-01-06,fakehistoryporn,13186,40,0,https://reddit.com/r/fakehistoryporn/comments/krmgde/the_first_doge_emerges_deep_from_within_the/
Doge,i made bunch of these physical dogecoins (their metal) and want to give them away free to my DOGE FAM!!,2021-06-27,dogecoin,12575,1353,0,https://reddit.com/r/dogecoin/comments/o92bsk/i_made_bunch_of_these_physical_dogecoins_their/
Doge,"TO THOSE HOLDING DOGE, UPVOTE EVERY DAMN THING THAT SAYS #DOGECOIN",2021-01-29,SatoshiStreetBets,11804,101,0,https://reddit.com/r/SatoshiStreetBets/comments/l7mpoi/to_those_holding_doge_upvote_every_damn_thing/
Doge,My friend found his dogecoin core wallet form high school with 2.5m DOGE on it,2021-05-03,CryptoCurrency,10494,1799,0,https://reddit.com/r/CryptoCurrency/comments/n3xin5/my_friend_found_his_dogecoin_core_wallet_form/
Doge,"Another day, another Elon Musk fiasco",2023-04-03,CuratedTumblr,10271,201,0,https://reddit.com/r/CuratedTumblr/comments/12b2ecx/another_day_another_elon_musk_fiasco/
Doge,My Mom Bought Dogecoin and then... Bought Doge,2021-04-19,dogecoin,9869,213,0,https://reddit.com/r/dogecoin/comments/mtt1mb/my_mom_bought_dogecoin_and_then_bought_doge/
Doge,Dogecoin is now worth $0.01!,2017-12-25,dogecoin,9583,610,0,https://reddit.com/r/dogecoin/comments/7lz346/dogecoin_is_now_worth_001/
Doge,Something Big is happening! I think Citadel is throwing everything they got at us!,2021-05-04,Superstonk,9533,1193,0,https://reddit.com/r/Superstonk/comments/n4uqs4/something_big_is_happening_i_think_citadel_is/
Doge,Who wants to make an announcement post?,2021-01-29,dogecoin,8879,3780,0,https://reddit.com/r/dogecoin/comments/l7n391/who_wants_to_make_an_announcement_post/
Doge,"For all of you shibes who are pledging to give money to dog shelters, adopt a dog or even start your own dog sanctuary. This doge has been blessed wit",2021-04-18,dogecoin,8418,348,0,https://reddit.com/r/dogecoin/comments/mtj79c/for_all_of_you_shibes_who_are_pledging_to_give/
This Is Fine Dog,"[Theory] Jar Jar Binks was a trained Force user, knowing Sith collaborator, and will play a central role in The Force Awakens",2015-10-30,StarWars,73292,8272,0,https://reddit.com/r/StarWars/comments/3qvj6w/theory_jar_jar_binks_was_a_trained_force_user/
This Is Fine Dog,"Either be fired or accept a massive pay cut. Ok, I'll take the firing.",2021-05-23,MaliciousCompliance,59923,1314,0,https://reddit.com/r/MaliciousCompliance/comments/nj7gtf/either_be_fired_or_accept_a_massive_pay_cut_ok/
This Is Fine Dog,HR tried to Get Rid of my Dad right before he was able to get his pension,2021-06-24,MaliciousCompliance,55089,2747,0,https://reddit.com/r/MaliciousCompliance/comments/o76kzv/hr_tried_to_get_rid_of_my_dad_right_before_he_was/
This Is Fine Dog,"My boss kept scheduling meetings during my lunch, so I started eating lunch in every meeting",2025-05-30,pettyrevenge,54809,1383,0,https://reddit.com/r/pettyrevenge/comments/1kz2ykl/my_boss_kept_scheduling_meetings_during_my_lunch/
This Is Fine Dog,"LPT: If your employer puts you on a performance improvement plan or suddenly starts asking for daily reports out of the blue, start looking for a job",2022-06-04,LifeProTips,50817,2170,0,https://reddit.com/r/LifeProTips/comments/v4ct0a/lpt_if_your_employer_puts_you_on_a_performance/
This Is Fine Dog,Fired for taking a sip of 99 cent tea while waiting in line to pay for it,2021-12-02,antiwork,49985,4813,0,https://reddit.com/r/antiwork/comments/r6z04x/fired_for_taking_a_sip_of_99_cent_tea_while/
This Is Fine Dog,LCD,2022-11-29,tumblr,45505,667,0,https://reddit.com/r/tumblr/comments/z839pu/lcd/
This Is Fine Dog,Keep screwing over your group members? This teacher is tired of your shit.,2020-03-10,ProRevenge,44188,2204,0,https://reddit.com/r/ProRevenge/comments/fg94q9/keep_screwing_over_your_group_members_this/
This Is Fine Dog,Owner refused to let me do jury duty,2021-04-21,MaliciousCompliance,44171,1281,0,https://reddit.com/r/MaliciousCompliance/comments/mvj9rr/owner_refused_to_let_me_do_jury_duty/
This Is Fine Dog,She Sold Happiness in Glass Jars,2019-03-24,nosleep,44119,634,0,https://reddit.com/r/nosleep/comments/b4vyxc/she_sold_happiness_in_glass_jars/
This Is Fine Dog,"They fired me because I got COVID, then needed me to fix a machine only I could fix in this country.",2022-01-14,antiwork,42994,1877,0,https://reddit.com/r/antiwork/comments/s43a5x/they_fired_me_because_i_got_covid_then_needed_me/
This Is Fine Dog,"Landlord is jealous of my income, raises my rent $500. I screw him years later for $20k.",2017-08-31,ProRevenge,41971,1045,0,https://reddit.com/r/ProRevenge/comments/6x9754/landlord_is_jealous_of_my_income_raises_my_rent/
This Is Fine Dog,Rap Fan Listens to 100 Great Rock Albums for the First Time,2022-04-18,Music,40740,5313,0,https://reddit.com/r/Music/comments/u6epgy/rap_fan_listens_to_100_great_rock_albums_for_the/
This Is Fine Dog,Megathread: President Trump delivers remarks on Charlottesville during Press Conference,2017-08-15,politics,39630,31747,0,https://reddit.com/r/politics/comments/6tx8h7/megathread_president_trump_delivers_remarks_on/
This Is Fine Dog,LPT: Know the Signs of Stroke. My dad had stroke on Christmas Eve. Got him to ER in 30 mins. He should be fine.,2020-12-27,LifeProTips,36863,1039,0,https://reddit.com/r/LifeProTips/comments/kkyl76/lpt_know_the_signs_of_stroke_my_dad_had_stroke_on/
This Is Fine Dog,"AITA for getting my coworker fired after she kept trying to ""prove"" my service dog is fake?",2024-10-28,AITAH,35863,5232,0,https://reddit.com/r/AITAH/comments/1gduiow/aita_for_getting_my_coworker_fired_after_she_kept/
This Is Fine Dog,TIFU by burning 700 lbs of marijuana and getting half of the military high.,2018-09-21,tifu,35599,1537,0,https://reddit.com/r/tifu/comments/9ho3ez/tifu_by_burning_700_lbs_of_marijuana_and_getting/
This Is Fine Dog,A Shattered Life,2018-01-30,nosleep,35456,691,0,https://reddit.com/r/nosleep/comments/7txais/a_shattered_life/
This Is Fine Dog,Walked out tonight.,2023-05-07,antiwork,34917,2652,0,https://reddit.com/r/antiwork/comments/13agnv6/walked_out_tonight/
This Is Fine Dog,"YSK in the US, ""At-will employment"" is misconstrued by employers to mean they can fire you for any reason or no reason. This is false and all employee",2022-04-09,YouShouldKnow,34881,777,0,https://reddit.com/r/YouShouldKnow/comments/tzsb30/ysk_in_the_us_atwill_employment_is_misconstrued/
This Is Fine Dog,"Megathread: Shots Fired at Trump Rally, Former President Evacuated by Secret Service",2024-07-13,politics,33074,33047,0,https://reddit.com/r/politics/comments/1e2n1kr/megathread_shots_fired_at_trump_rally_former/
This Is Fine Dog,"My boss demanded that I replace all my pants, and then told me she needed to supervise me while I got the replacements. She is now on administrative l",2021-12-13,TrueOffMyChest,32460,1063,0,https://reddit.com/r/TrueOffMyChest/comments/rfquv0/my_boss_demanded_that_i_replace_all_my_pants_and/
This Is Fine Dog,Was forced to do a task. Got my entire Chain of Command fired.,2021-02-16,MaliciousCompliance,32448,1299,0,https://reddit.com/r/MaliciousCompliance/comments/ll2b6u/was_forced_to_do_a_task_got_my_entire_chain_of/
This Is Fine Dog,Is it ok if I fire you?,2021-05-20,MaliciousCompliance,32048,521,0,https://reddit.com/r/MaliciousCompliance/comments/nhcaqp/is_it_ok_if_i_fire_you/
This Is Fine Dog,TIFU and now I have to hide my leg from my husband for a week or more,2021-02-02,tifu,31674,1011,0,https://reddit.com/r/tifu/comments/lb5qlm/tifu_and_now_i_have_to_hide_my_leg_from_my/
Wojak,Guy gets to feel like a kid again instead of being seen as creepy,2021-08-05,MadeMeSmile,233119,2909,0,https://reddit.com/r/MadeMeSmile/comments/oy86j3/guy_gets_to_feel_like_a_kid_again_instead_of/
Wojak,📣 Apollo will close down on June 30th. Reddit’s recent decisions and actions have unfortunately made it impossible for Apollo to continue. Thank you s,2023-06-08,apolloapp,221155,15247,0,https://reddit.com/r/apolloapp/comments/144f6xm/apollo_will_close_down_on_june_30th_reddits/
Wojak,Megathread: Joe Biden Projected to Defeat President Donald Trump and Win the 2020 US Presidential Election,2020-11-07,politics,214318,80807,0,https://reddit.com/r/politics/comments/jptq5n/megathread_joe_biden_projected_to_defeat/
Wojak,A doctor’s letter to UnitedHeathcare for denying nausea medication to a child on chemotherapy,2024-12-05,interestingasfuck,161815,2347,0,https://reddit.com/r/interestingasfuck/comments/1h7jh11/a_doctors_letter_to_unitedheathcare_for_denying/
Wojak,A doctor’s letter to United Heathcare for denying nausea meds for a child on chemo,2024-12-05,MurderedByWords,150221,4765,0,https://reddit.com/r/MurderedByWords/comments/1h770le/a_doctors_letter_to_united_heathcare_for_denying/
Wojak,Guy gets to feel like a kid again instead of being seen as creepy,2022-12-12,MadeMeSmile,147596,1394,0,https://reddit.com/r/MadeMeSmile/comments/zjy2se/guy_gets_to_feel_like_a_kid_again_instead_of/
Wojak,TIFU by spending the last year on reddit talking to myself after being muted.,2019-04-10,tifu,143717,3107,0,https://reddit.com/r/tifu/comments/bbgmzp/tifu_by_spending_the_last_year_on_reddit_talking/
Wojak,TIFU by owning a Golden Retriever while being Black.,2020-08-05,tifu,139834,7059,0,https://reddit.com/r/tifu/comments/i3xnlq/tifu_by_owning_a_golden_retriever_while_being/
Wojak,"📣 I want to debunk Reddit's claims, and talk about their unwillingness to work with developers, moderators, and the larger community, as well as say t",2023-06-19,apolloapp,134033,5397,0,https://reddit.com/r/apolloapp/comments/14dkqrw/i_want_to_debunk_reddits_claims_and_talk_about/
Wojak,TIFU: I have officially branded myself as the biggest perv... and I 100% deserve it...,2019-05-17,tifu,127636,15765,0,https://reddit.com/r/tifu/comments/bpr2iy/tifu_i_have_officially_branded_myself_as_the/
Wojak,"Youtuber ""Potates"" completely plagiarized a post I made on r/Fallout about Fallout 76, and passed it off as his own work. The video is now at 800k vie",2018-06-21,gaming,127324,4659,0,https://reddit.com/r/gaming/comments/8swmb2/youtuber_potates_completely_plagiarized_a_post_i/
Wojak,Update: My (32F) husband (36M) became a robot and I don’t know how to help him.,2020-07-07,relationship_advice,116756,3885,0,https://reddit.com/r/relationship_advice/comments/hmzvgt/update_my_32f_husband_36m_became_a_robot_and_i/
Wojak,"UPDATE: My girlfriend told me she was with a friend, but that friend was with me picking out an engagement ring. How do I confront my girlfriend about",2020-07-01,relationship_advice,116241,5579,0,https://reddit.com/r/relationship_advice/comments/hjkgnj/update_my_girlfriend_told_me_she_was_with_a/
Wojak,Dying Before April: My Endgame,2019-01-05,marvelstudios,114894,3933,0,https://reddit.com/r/marvelstudios/comments/actrm0/dying_before_april_my_endgame/
Wojak,TIFU by stuffing my face with edibles before dinner with my wife's parents.,2018-01-09,tifu,107674,4409,0,https://reddit.com/r/tifu/comments/7pafrt/tifu_by_stuffing_my_face_with_edibles_before/
Wojak,How does it feel being the smartest guy on the internet,2020-07-02,memes,102578,479,0,https://reddit.com/r/memes/comments/hjovph/how_does_it_feel_being_the_smartest_guy_on_the/
Wojak,Wikipedia built the biggest modern information hub using nothing but nerds' need to correct each other.,2019-10-04,Showerthoughts,97524,986,0,https://reddit.com/r/Showerthoughts/comments/dd96t6/wikipedia_built_the_biggest_modern_information/
Wojak,TIFU by jumping into a lake in my bra/panties to save a man that turned out to be an elite military scuba diver in training,2020-06-12,tifu,93920,3539,0,https://reddit.com/r/tifu/comments/h7mzd3/tifu_by_jumping_into_a_lake_in_my_brapanties_to/
Wojak,Found his owners and they didn't want him,2025-07-25,cats,92967,2821,0,https://reddit.com/r/cats/comments/1m9ce97/found_his_owners_and_they_didnt_want_him/
Wojak,Meirl,2025-05-28,meirl,90878,296,0,https://reddit.com/r/meirl/comments/1kxsxdq/meirl/
Wojak,"Can you say ""CLASS ACTION LAWSUIT"". Fuck you RobinHood",2021-01-28,wallstreetbets,86779,3810,0,https://reddit.com/r/wallstreetbets/comments/l6wbbj/can_you_say_class_action_lawsuit_fuck_you/
Wojak,Guy gets to feel like a kid again instead of being seen as creepy,2025-09-09,MadeMeSmile,81829,536,0,https://reddit.com/r/MadeMeSmile/comments/1ncnhf6/guy_gets_to_feel_like_a_kid_again_instead_of/
Wojak,TIFU and realized I wasted my whole life. at 42 years of age took the safe path as a dentist. My advise to people at a similar age.,2020-11-06,tifu,81490,7108,0,https://reddit.com/r/tifu/comments/joz1c5/tifu_and_realized_i_wasted_my_whole_life_at_42/
Wojak,I feel sorry for this guy,2022-08-28,technicallythetruth,81246,384,0,https://reddit.com/r/technicallythetruth/comments/wzsy1r/i_feel_sorry_for_this_guy/
Wojak,META: This sub is moving towards a value system that frequently doesn't align with the rest of the world,2019-09-20,AmItheAsshole,80910,6142,0,https://reddit.com/r/AmItheAsshole/comments/d6xoro/meta_this_sub_is_moving_towards_a_value_system/
Pepe The Frog,Pepe the Frog is your Meme of the Decade,2020-01-30,dankmemes,135375,2732,0,https://reddit.com/r/dankmemes/comments/ew6oev/pepe_the_frog_is_your_meme_of_the_decade/
Pepe The Frog,"My cat Pepe loved my roomie, and she recently moved out. I’m not crying, you’re crying...",2018-03-15,aww,125691,2288,0,https://reddit.com/r/aww/comments/84nz9p/my_cat_pepe_loved_my_roomie_and_she_recently/
Pepe The Frog,"A very excited crow (Pepe) visiting his favourite person. From a helpless, wounded chick to a self-sufficient bird thriving in the wild, all thanks to",2023-04-28,interestingasfuck,105156,930,0,https://reddit.com/r/interestingasfuck/comments/131e018/a_very_excited_crow_pepe_visiting_his_favourite/
Pepe The Frog,Blursed_pepe,2020-08-11,blursedimages,75193,260,0,https://reddit.com/r/blursedimages/comments/i7nx5g/blursed_pepe/
Pepe The Frog,Pepe Le Pew fired from Warner Bros Amid Alleged Sexual Harassment Allegations,2017-12-08,funny,74597,1762,0,https://reddit.com/r/funny/comments/7ifq3x/pepe_le_pew_fired_from_warner_bros_amid_alleged/
Pepe The Frog,Pepe review,2019-12-26,PewdiepieSubmissions,62006,320,0,https://reddit.com/r/PewdiepieSubmissions/comments/efu5y5/pepe_review/
Pepe The Frog,"Meanwhile, Pepe is a symbol of freedom fighters in HK right now.",2019-11-08,PewdiepieSubmissions,60918,661,0,https://reddit.com/r/PewdiepieSubmissions/comments/dtc252/meanwhile_pepe_is_a_symbol_of_freedom_fighters_in/
Pepe The Frog,[Request] is this true,2026-02-27,theydidthemath,56310,2166,0,https://reddit.com/r/theydidthemath/comments/1rfwegz/request_is_this_true/
Pepe The Frog,Have I been bamboozled? Is this really worth more than Tritium Pepe?,2017-02-28,MemeEconomy,52440,324,0,https://reddit.com/r/MemeEconomy/comments/5wo6it/have_i_been_bamboozled_is_this_really_worth_more/
Pepe The Frog,happy pepe,2020-04-12,memes,48713,176,0,https://reddit.com/r/memes/comments/fzvma1/happy_pepe/
Pepe The Frog,Megathread: Donald Trump Jr. Releases Correspondence from Russian Lawyer,2017-07-11,politics,44283,19475,0,https://reddit.com/r/politics/comments/6mn1zp/megathread_donald_trump_jr_releases/
Pepe The Frog,6 weeks of creating Pepe in 16 seconds,2024-04-04,nextfuckinglevel,41026,285,0,https://reddit.com/r/nextfuckinglevel/comments/1bvofpi/6_weeks_of_creating_pepe_in_16_seconds/
Pepe The Frog,Help pepe by donating 1 gold pls.,2020-12-17,dankmemes,39493,180,0,https://reddit.com/r/dankmemes/comments/kevue7/help_pepe_by_donating_1_gold_pls/
Pepe The Frog,pepe,2025-08-03,comedyheaven,39310,923,0,https://reddit.com/r/comedyheaven/comments/1mglll6/pepe/
Pepe The Frog,The creator of Pepe the Frog is suing InfoWars,2018-03-07,news,39163,2554,0,https://reddit.com/r/news/comments/82sddi/the_creator_of_pepe_the_frog_is_suing_infowars/
Pepe The Frog,My father just passed away—wanted to share his projects,2026-01-28,woodworking,38195,850,0,https://reddit.com/r/woodworking/comments/1qoz2ds/my_father_just_passed_awaywanted_to_share_his/
Pepe The Frog,creddit to u/ascending_pepe,2019-01-08,HistoryMemes,37378,212,0,https://reddit.com/r/HistoryMemes/comments/adykka/creddit_to_uascending_pepe/
Pepe The Frog,"Damn those Chinese, making Pepe spill his food",2021-06-20,HistoryMemes,35013,371,0,https://reddit.com/r/HistoryMemes/comments/o48d69/damn_those_chinese_making_pepe_spill_his_food/
Pepe The Frog,"This is the rare Diamond Pepe: it only appears every 20,000,000 memes. Upvote for good luck in 2017!!",2016-12-30,dank_meme,34969,196,0,https://reddit.com/r/dank_meme/comments/5l6glm/this_is_the_rare_diamond_pepe_it_only_appears/
Pepe The Frog,Anti-Defamation League Declares Pepe the Frog a Hate Symbol,2016-09-27,nottheonion,34827,4108,0,https://reddit.com/r/nottheonion/comments/54tleo/antidefamation_league_declares_pepe_the_frog_a/
Pepe The Frog,We love you Pepe,2019-12-08,dankmemes,33935,286,0,https://reddit.com/r/dankmemes/comments/e7tg75/we_love_you_pepe/
Pepe The Frog,"The Pepe I posted earlier this week was hit by a meteorite today, really feelsbadman.",2019-12-30,Terraria,31245,410,0,https://reddit.com/r/Terraria/comments/ehryp4/the_pepe_i_posted_earlier_this_week_was_hit_by_a/
