meme_name,post_title,post_date,subreddit,score,num_comments,awards,url
Pepe The Frog,Pepe 2020,2019-12-12,dankmemes,30914,511,0,https://reddit.com/r/dankmemes/comments/e9ofzx/pepe_2020/
Pepe The Frog,All-NBA name teams.,2019-07-20,nba,30876,1321,0,https://reddit.com/r/nba/comments/cfmkx2/allnba_name_teams/
Pepe The Frog,Shoutout to the professor for still giving a D,2023-12-19,madlads,29576,756,0,https://reddit.com/r/madlads/comments/18lzrcl/shoutout_to_the_professor_for_still_giving_a_d/
Drake Hotline Bling,This button used to say “R/T” but now it just looks like Drake dancing in “Hotline Bling”,2018-03-10,mildlyinteresting,43975,543,0,https://reddit.com/r/mildlyinteresting/comments/83fejh/this_button_used_to_say_rt_but_now_it_just_looks/
Drake Hotline Bling,Etika has passed away.,2019-06-25,dankmemes,34875,1903,0,https://reddit.com/r/dankmemes/comments/c5c77j/etika_has_passed_away/
Drake Hotline Bling,Please control your risk. Please protect your mental health and wellbeing.,2021-02-03,wallstreetbets,31570,2016,0,https://reddit.com/r/wallstreetbets/comments/lbj15v/please_control_your_risk_please_protect_your/
Drake Hotline Bling,"I averaged 14 ""Best Games of All Time"" lists from the last five years together, and these are the results",2023-11-26,gaming,28312,3072,0,https://reddit.com/r/gaming/comments/184e4zj/i_averaged_14_best_games_of_all_time_lists_from/
Drake Hotline Bling,Drake meme still alive?,2020-08-18,memes,27131,100,0,https://reddit.com/r/memes/comments/ibxkv7/drake_meme_still_alive/
Drake Hotline Bling,Etika has passed away,2019-06-25,PewdiepieSubmissions,26825,1335,0,https://reddit.com/r/PewdiepieSubmissions/comments/c5cfj2/etika_has_passed_away/
Drake Hotline Bling,Hotline Bling Cat,2015-11-06,videos,26747,1138,0,https://reddit.com/r/videos/comments/3rrzyk/hotline_bling_cat/
Drake Hotline Bling,"Teachers who try to connect with this generation via course related ""memes"" should be praised because they're trying instead of doing boring lessons",2019-01-19,unpopularopinion,26072,454,0,https://reddit.com/r/unpopularopinion/comments/ahotja/teachers_who_try_to_connect_with_this_generation/
Drake Hotline Bling,When your hotline ain't blinging,2017-11-14,BlackPeopleTwitter,25756,126,0,https://reddit.com/r/BlackPeopleTwitter/comments/7cu5ib/when_your_hotline_aint_blinging/
Drake Hotline Bling,New Drake meme,2020-02-22,memes,25541,330,0,https://reddit.com/r/memes/comments/f7uza0/new_drake_meme/
Drake Hotline Bling,110 reasons to NOT commit suicide,2020-09-27,copypasta,23232,1341,0,https://reddit.com/r/copypasta/comments/j0ku0m/110_reasons_to_not_commit_suicide/
Drake Hotline Bling,Drake - Hotline Bling,2016-05-10,gaming,20967,862,0,https://reddit.com/r/gaming/comments/4iqdh9/drake_hotline_bling/
Drake Hotline Bling,hahaha drake meme funny,2020-11-20,dankmemes,20819,90,0,https://reddit.com/r/dankmemes/comments/jxoqqz/hahaha_drake_meme_funny/
Drake Hotline Bling,"A friend of mine got a present wrapped in Drake ""Hotline Bling"" wrapping paper",2015-12-27,mildlyinteresting,20710,532,0,https://reddit.com/r/mildlyinteresting/comments/3yebyg/a_friend_of_mine_got_a_present_wrapped_in_drake/
Drake Hotline Bling,Hotline bling,2018-01-24,BlackPeopleTwitter,16804,233,0,https://reddit.com/r/BlackPeopleTwitter/comments/7sqzfu/hotline_bling/
Drake Hotline Bling,just how I feel,2017-09-13,PrequelMemes,15905,135,0,https://reddit.com/r/PrequelMemes/comments/6zyac7/just_how_i_feel/
Drake Hotline Bling,DRAKE HELPS LIL’ YACHTY WITH HIS COMPUTER IS YOUR APRIL 2021 MEME OF THE MONTH,2021-05-31,dankmemes,15410,116,0,https://reddit.com/r/dankmemes/comments/npanyi/drake_helps_lil_yachty_with_his_computer_is_your/
Drake Hotline Bling,hotline bling,2015-11-13,funny,14910,206,0,https://reddit.com/r/funny/comments/3snr1t/hotline_bling/
Drake Hotline Bling,Is merging the Drake meme and the great Robbie Rotten a good investment?,2017-06-25,MemeEconomy,14178,171,0,https://reddit.com/r/MemeEconomy/comments/6jdxel/is_merging_the_drake_meme_and_the_great_robbie/
Drake Hotline Bling,Since Drake memes are all the rage these days,2018-03-26,LateStageCapitalism,13265,296,0,https://reddit.com/r/LateStageCapitalism/comments/87558a/since_drake_memes_are_all_the_rage_these_days/
Drake Hotline Bling,Drake meme by a cheap watch company,2018-09-06,FellowKids,13212,219,0,https://reddit.com/r/FellowKids/comments/9dgsl8/drake_meme_by_a_cheap_watch_company/
Drake Hotline Bling,Drake and Josh meme has big potential,2018-02-10,MemeEconomy,11673,128,0,https://reddit.com/r/MemeEconomy/comments/7wp7o9/drake_and_josh_meme_has_big_potential/
Drake Hotline Bling,Put the fries in the bag drake,2025-03-20,yescompanionimbecil,10725,11,0,https://reddit.com/r/yescompanionimbecil/comments/1jfpkad/put_the_fries_in_the_bag_drake/
Drake Hotline Bling,Drake - Hotline bling - youtube comment,2015-11-04,BlackPeopleTwitter,10043,301,0,https://reddit.com/r/BlackPeopleTwitter/comments/3rj0sb/drake_hotline_bling_youtube_comment/
Drake Hotline Bling,Daily reminder that hotline bling won a Grammy over this.,2020-08-05,Kanye,9762,412,0,https://reddit.com/r/Kanye/comments/i3xqdm/daily_reminder_that_hotline_bling_won_a_grammy/
Galaxy Brain,"Taika Waititi Will Expand ‘Star Wars’ Away from Preexisting Characters, Forget Prequel Origin Stories. The galaxy far, far away will no longer look ba",2022-06-14,boxoffice,36514,2990,0,https://reddit.com/r/boxoffice/comments/vcfhab/taika_waititi_will_expand_star_wars_away_from/
Galaxy Brain,Insert brain expanding template,2020-11-20,memes,36458,100,0,https://reddit.com/r/memes/comments/jy04kg/insert_brain_expanding_template/
Galaxy Brain,LPT: Your hearing is not invincible. Please lower your volume when listening to music. Bring earplugs to concerts. Do not make the same mistake I made,2017-02-13,LifeProTips,33864,3274,0,https://reddit.com/r/LifeProTips/comments/5tqj0t/lpt_your_hearing_is_not_invincible_please_lower/
Galaxy Brain,TIFU by letting mom find the cum wall...,2020-02-03,tifu,31862,1864,0,https://reddit.com/r/tifu/comments/ey5lhn/tifu_by_letting_mom_find_the_cum_wall/
Galaxy Brain,Galaxy brain take,2019-10-19,insanepeoplefacebook,31695,1404,0,https://reddit.com/r/insanepeoplefacebook/comments/dk5y6l/galaxy_brain_take/
Galaxy Brain,I made an expanding brain template for his birthday.,2018-10-29,memes,31072,143,0,https://reddit.com/r/memes/comments/9se0xl/i_made_an_expanding_brain_template_for_his/
Galaxy Brain,Some Galaxy brain moves here,2022-07-31,tumblr,29786,288,0,https://reddit.com/r/tumblr/comments/wcmp58/some_galaxy_brain_moves_here/
Galaxy Brain,Sometimes a UTI.. isn’t a UTI 😅,2025-12-17,OneOrangeBraincell,29189,455,0,https://reddit.com/r/OneOrangeBraincell/comments/1pp4aid/sometimes_a_uti_isnt_a_uti/
Galaxy Brain,"Box Office Week: Kingsman: The Golden Circle comes in #1 with a solid $39M while The LEGO Ninjago Movie flops at #3 with $21.5M, $30M less than LEGO B",2017-09-25,movies,27571,1889,0,https://reddit.com/r/movies/comments/72d0vf/box_office_week_kingsman_the_golden_circle_comes/
Galaxy Brain,It insists upon itself ,2025-01-04,okbuddycinephile,26644,325,0,https://reddit.com/r/okbuddycinephile/comments/1htclzf/it_insists_upon_itself/
Galaxy Brain,I spent the past year listening to over 7500 songs that were posted to reddit by independent artists. Have you ever wondered what the Grammy's would l,2022-05-08,Music,25599,1008,0,https://reddit.com/r/Music/comments/ul0yzq/i_spent_the_past_year_listening_to_over_7500/
Galaxy Brain,I am the accidental IT guy + anti-poaching pilot in the Central African Bush that got pissed at Microsoft for their Windows 10 shenanigans. I'm here w,2016-06-04,IAmA,25109,1612,0,https://reddit.com/r/IAmA/comments/4mirin/i_am_the_accidental_it_guy_antipoaching_pilot_in/
Galaxy Brain,"GameStop's Bull Thesis: GameStop's history. Due diligence supporting shorts have not closed, they 'covered' through derivative manipulation. GME with ",2022-04-04,Superstonk,23344,504,0,https://reddit.com/r/Superstonk/comments/tw641b/gamestops_bull_thesis_gamestops_history_due/
Galaxy Brain,LPT Expand ALL acronyms on first usage.,2022-07-04,LifeProTips,23337,1925,0,https://reddit.com/r/LifeProTips/comments/vrbiw8/lpt_expand_all_acronyms_on_first_usage/
Galaxy Brain,Galaxy brain,2024-10-22,CuratedTumblr,23323,329,0,https://reddit.com/r/CuratedTumblr/comments/1g9p8zc/galaxy_brain/
Galaxy Brain,Galaxy brain maneuvers,2022-09-21,NonCredibleDefense,19609,198,0,https://reddit.com/r/NonCredibleDefense/comments/xk2i96/galaxy_brain_maneuvers/
Galaxy Brain,"Entitled, gossipy witch sabotages my totally legal, romantic relationship with my former teacher, ruins her career, and runs us both out of town? How ",2019-06-09,ProRevenge,19206,914,0,https://reddit.com/r/ProRevenge/comments/bypj9w/entitled_gossipy_witch_sabotages_my_totally_legal/
Galaxy Brain,BRAIN EXPANDING IS THE 2017 MEME OF THE YEAR,2018-01-08,dankmemes,19162,420,0,https://reddit.com/r/dankmemes/comments/7ovxmx/brain_expanding_is_the_2017_meme_of_the_year/
Galaxy Brain,🎮 Game Stop 🛑,2021-06-01,Superstonk,18932,3933,0,https://reddit.com/r/Superstonk/comments/nplhx7/game_stop/
Galaxy Brain,Truly Genius ,2025-01-03,greentext,18310,199,0,https://reddit.com/r/greentext/comments/1hss0ol/truly_genius/
Galaxy Brain,Zooming into a Supernova Double explosion remnant,2025-07-03,spaceporn,17755,285,0,https://reddit.com/r/spaceporn/comments/1lqkxyi/zooming_into_a_supernova_double_explosion_remnant/
Galaxy Brain,UPDATE: Try not to make fun of me. I bought my boyfriend a gift and epically failed.,2025-12-20,tolkienbooks,16510,410,0,https://reddit.com/r/tolkienbooks/comments/1pr3j34/update_try_not_to_make_fun_of_me_i_bought_my/
Galaxy Brain,Brains expanding,2020-09-01,memes,15344,117,0,https://reddit.com/r/memes/comments/ikkgpj/brains_expanding/
Galaxy Brain,"Jason Collins: ""A few months ago, my family released a short statement saying I had a brain tumor. It was simple, but intentionally vague. They did th",2025-12-11,nba,15274,679,0,https://reddit.com/r/nba/comments/1pk2b54/jason_collins_a_few_months_ago_my_family_released/
Galaxy Brain,The Sisters of House Omega,2019-09-23,nosleep,15259,296,0,https://reddit.com/r/nosleep/comments/d80zl0/the_sisters_of_house_omega/
Stonks,"Can you say ""CLASS ACTION LAWSUIT"". Fuck you RobinHood",2021-01-28,wallstreetbets,86782,3810,0,https://reddit.com/r/wallstreetbets/comments/l6wbbj/can_you_say_class_action_lawsuit_fuck_you/
Stonks,I feel like clarification is needed about Today,2021-02-02,wallstreetbets,80089,4903,0,https://reddit.com/r/wallstreetbets/comments/laikd0/i_feel_like_clarification_is_needed_about_today/
Stonks,"Beware those who are shilling other stocks claiming they're the next GME! They're just trying to get your attention, and they're succeeding! 🚨",2021-01-30,wallstreetbets,58633,5636,0,https://reddit.com/r/wallstreetbets/comments/l8izo3/beware_those_who_are_shilling_other_stocks/
Stonks,Please stop promoting Belfort,2021-02-02,wallstreetbets,44337,1363,0,https://reddit.com/r/wallstreetbets/comments/lai796/please_stop_promoting_belfort/
Stonks,Waking up to make sure my meme stonks are still down,2021-02-12,wallstreetbets,40366,729,0,https://reddit.com/r/wallstreetbets/comments/lieb7j/waking_up_to_make_sure_my_meme_stonks_are_still/
Stonks,"Thank you for this moment, you've given me purpose",2021-01-28,wallstreetbets,40210,1499,0,https://reddit.com/r/wallstreetbets/comments/l78m9p/thank_you_for_this_moment_youve_given_me_purpose/
Stonks,guess I’ll celebrate,2017-08-01,wholesomememes,40187,252,0,https://reddit.com/r/wholesomememes/comments/6qzunu/guess_ill_celebrate/
Stonks,You are all being ridiculous with these endless posts,2021-06-09,wallstreetbets,38542,4763,0,https://reddit.com/r/wallstreetbets/comments/nvz2p3/you_are_all_being_ridiculous_with_these_endless/
Stonks,------------- Dear Elon -------------,2021-02-07,wallstreetbets,36128,1418,0,https://reddit.com/r/wallstreetbets/comments/lemfzi/dear_elon/
Stonks,For you noobs,2021-06-03,wallstreetbets,35779,2286,0,https://reddit.com/r/wallstreetbets/comments/nrbin0/for_you_noobs/
Stonks,Basic guide to Wallstreetbets culture for Newcomers,2021-01-29,wallstreetbets,33433,1475,0,https://reddit.com/r/wallstreetbets/comments/l7fr21/basic_guide_to_wallstreetbets_culture_for/
Stonks,This meme was posted here over a year ago - Keeping this in mind is how I've always managed to get in and out for profit on any WSB mentioned stock,2021-02-12,wallstreetbets,32593,608,0,https://reddit.com/r/wallstreetbets/comments/lifm0y/this_meme_was_posted_here_over_a_year_ago_keeping/
Stonks,GME EndGame part 3: A new opponent enters the ring,2021-01-26,wallstreetbets,32274,3966,0,https://reddit.com/r/wallstreetbets/comments/l528pz/gme_endgame_part_3_a_new_opponent_enters_the_ring/
Stonks,Stock photo memes make the best memes,2020-09-15,memes,31783,78,0,https://reddit.com/r/memes/comments/itik68/stock_photo_memes_make_the_best_memes/
Stonks,Fresh technical analysis on TSLA from our favorite meme stock analyst,2020-12-21,wallstreetbets,31165,482,0,https://reddit.com/r/wallstreetbets/comments/khk0kl/fresh_technical_analysis_on_tsla_from_our/
Stonks,GameStop Short Sellers Just Lost $2 Billion Amid Meme Stock Rally,2024-05-14,technology,30163,2951,0,https://reddit.com/r/technology/comments/1cs1fie/gamestop_short_sellers_just_lost_2_billion_amid/
Stonks,Me preparing to throw large sums of money at the new meme stock,2020-12-16,wallstreetbets,29734,509,0,https://reddit.com/r/wallstreetbets/comments/kedxro/me_preparing_to_throw_large_sums_of_money_at_the/
Stonks,When you wish upon a star - a complete guide to Computershare,2021-09-23,Superstonk,29645,3147,0,https://reddit.com/r/Superstonk/comments/ptvaka/when_you_wish_upon_a_star_a_complete_guide_to/
Stonks,“So how much money have you made off all those meme stocks you bought into?”,2021-06-20,wallstreetbets,28930,2615,0,https://reddit.com/r/wallstreetbets/comments/o3u7z1/so_how_much_money_have_you_made_off_all_those/
Stonks,Except for the stonks meme,2020-06-21,memes,27154,296,0,https://reddit.com/r/memes/comments/hcxuih/except_for_the_stonks_meme/
Stonks,What $GME has taught me in 36 hours of day trading,2021-02-02,stocks,26741,5491,0,https://reddit.com/r/stocks/comments/lazcak/what_gme_has_taught_me_in_36_hours_of_day_trading/
Stonks,Sudden rise in stonks of perfectly executed older memes.,2019-10-13,MemeEconomy,26501,99,0,https://reddit.com/r/MemeEconomy/comments/dh7s2g/sudden_rise_in_stonks_of_perfectly_executed_older/
Stonks,"I believe: Free Markets Cannot Be Free, Unless They Are Fair. So I stand now, and choose to fight. My name is Alexander Ross Cohen. I am an APE. I hav",2021-06-11,Superstonk,26333,1633,0,https://reddit.com/r/Superstonk/comments/nxe8qd/i_believe_free_markets_cannot_be_free_unless_they/
Stonks,What the actual fuck mods? Who pissed in your fucking cheerios to make you want to remove any joy from this place? This sub looks like fucking r/stock,2022-02-03,wallstreetbets,24813,1713,0,https://reddit.com/r/wallstreetbets/comments/sjrjce/what_the_actual_fuck_mods_who_pissed_in_your/
Stonks,"The 2022 Real Estate Collapse is going to be Worse than the 2008 One, and Nobody Knows About It - Time to Call your Mom",2022-04-30,Superstonk,24761,1886,0,https://reddit.com/r/Superstonk/comments/uflzht/the_2022_real_estate_collapse_is_going_to_be/
Coffin Dance,"Coronavirus car playing coffin dance music in Buenos Aires, Argentina. (My life is now complete)",2020-08-01,PublicFreakout,81261,846,0,https://reddit.com/r/PublicFreakout/comments/i1ydw6/coronavirus_car_playing_coffin_dance_music_in/
Coffin Dance,Pewds already reacted to the coffin dance 3 years ago : /,2020-04-25,PewdiepieSubmissions,52363,436,0,https://reddit.com/r/PewdiepieSubmissions/comments/g7pz2i/pewds_already_reacted_to_the_coffin_dance_3_years/
Coffin Dance,My son wanted to be the “Coffin Dance Guys” for his Halloween costume.,2020-10-23,videos,44856,1383,0,https://reddit.com/r/videos/comments/jgnwhc/my_son_wanted_to_be_the_coffin_dance_guys_for_his/
Coffin Dance,I Recreated Coffin Dancing Meme in GTA V,2020-04-11,gtaonline,34619,479,0,https://reddit.com/r/gtaonline/comments/fzdsly/i_recreated_coffin_dancing_meme_in_gta_v/
Coffin Dance,ASTRONOMIA COFFIN DANCE IS YOUR MARCH 2020 MEME OF THE MONTH,2020-04-26,dankmemes,34103,319,0,https://reddit.com/r/dankmemes/comments/g8hvxe/astronomia_coffin_dance_is_your_march_2020_meme/
Coffin Dance,He saved me from the coffin dance,2020-07-03,memes,32863,144,0,https://reddit.com/r/memes/comments/hk8v03/he_saved_me_from_the_coffin_dance/
Coffin Dance,"Coffins in Ghana are often made to reflect the person’s life, personality or profession",2024-07-12,Damnthatsinteresting,27444,670,0,https://reddit.com/r/Damnthatsinteresting/comments/1e1bcbv/coffins_in_ghana_are_often_made_to_reflect_the/
Coffin Dance,*coffin dance music plays*,2020-11-30,dankmemes,18638,138,0,https://reddit.com/r/dankmemes/comments/k3zxgj/coffin_dance_music_plays/
Coffin Dance,"Remember the Ghana Coffin Dancers? They recently made a video thanking doctors for their hardwork. They also warned, “Stay home, or come dance with us",2020-05-05,teenagers,18107,116,0,https://reddit.com/r/teenagers/comments/ge6y60/remember_the_ghana_coffin_dancers_they_recently/
Coffin Dance,This pepper coffin you can buy from Ghana,2018-07-11,ATBGE,15103,281,0,https://reddit.com/r/ATBGE/comments/8xy9t6/this_pepper_coffin_you_can_buy_from_ghana/
Coffin Dance,Coffin Dance but in Fortnite,2020-05-13,FortNiteBR,14997,428,0,https://reddit.com/r/FortNiteBR/comments/gj1voh/coffin_dance_but_in_fortnite/
Coffin Dance,Coffin Dance Song,2020-04-23,nextfuckinglevel,14687,167,0,https://reddit.com/r/nextfuckinglevel/comments/g6v7b1/coffin_dance_song/
Coffin Dance,Whoever mixed Piggy with coffin dance has something wrong with them,2020-06-20,GoCommitDie,14034,155,0,https://reddit.com/r/GoCommitDie/comments/hcwab7/whoever_mixed_piggy_with_coffin_dance_has/
Coffin Dance,“Coffin dance meme”,2020-07-27,dankmemes,13687,81,0,https://reddit.com/r/dankmemes/comments/hz0kj3/coffin_dance_meme/
Coffin Dance,New Update: AITA for laughing at my stepson and ruining his wedding?,2025-06-19,BestofRedditorUpdates,10602,449,0,https://reddit.com/r/BestofRedditorUpdates/comments/1lf1kr9/new_update_aita_for_laughing_at_my_stepson_and/
Coffin Dance,tf2 coffin dance,2020-04-10,tf2,9735,157,0,https://reddit.com/r/tf2/comments/fyn8us/tf2_coffin_dance/
Coffin Dance,"Hyperinflation is Coming- The Dollar Endgame: PART 1, “A New Rome”",2021-06-21,Superstonk,9310,598,0,https://reddit.com/r/Superstonk/comments/o4w45f/hyperinflation_is_coming_the_dollar_endgame_part/
Coffin Dance,TIFU by telling my new wife I didn't care if she cheated on me,2021-09-20,tifu,8922,1736,0,https://reddit.com/r/tifu/comments/prvuqg/tifu_by_telling_my_new_wife_i_didnt_care_if_she/
Coffin Dance,AITA for laughing at my stepson and ruining his wedding?,2025-04-30,BestofRedditorUpdates,8701,589,0,https://reddit.com/r/BestofRedditorUpdates/comments/1kb7im3/aita_for_laughing_at_my_stepson_and_ruining_his/
Coffin Dance,Coffin dance intensifies,2020-04-28,dankmemes,8695,47,0,https://reddit.com/r/dankmemes/comments/g9k7kb/coffin_dance_intensifies/
Coffin Dance,My self-made coffin dance meme,2020-04-12,Animemes,8446,106,0,https://reddit.com/r/Animemes/comments/fzwuw5/my_selfmade_coffin_dance_meme/
Coffin Dance,*coffin dance intensifies*,2020-05-05,memes,8347,100,0,https://reddit.com/r/memes/comments/gdomyv/coffin_dance_intensifies/
Coffin Dance,Ghana Coffin Dance Theme using Calculator,2020-05-15,nextfuckinglevel,8224,136,0,https://reddit.com/r/nextfuckinglevel/comments/gk3b80/ghana_coffin_dance_theme_using_calculator/
Coffin Dance,When the coffin dance meme meets Overwatch,2020-04-25,Overwatch,8084,167,0,https://reddit.com/r/Overwatch/comments/g7vmro/when_the_coffin_dance_meme_meets_overwatch/
Coffin Dance,My boyfriend took care of me when I was too drunk to have sex and refuses to let me feel guilty that I couldn’t follow through on my promises.,2019-04-29,TwoXChromosomes,7826,883,0,https://reddit.com/r/TwoXChromosomes/comments/bip7ka/my_boyfriend_took_care_of_me_when_i_was_too_drunk/
Chad Vs Virgin,"My son is a hateful incel, and I just cannot save him or defend him anymore.",2018-11-10,self,58761,8615,0,https://reddit.com/r/self/comments/9vs05k/my_son_is_a_hateful_incel_and_i_just_cannot_save/
Chad Vs Virgin,"Chad the Impaler, slayer of virgins",2019-06-01,Bossfight,58403,795,0,https://reddit.com/r/Bossfight/comments/bvjzpq/chad_the_impaler_slayer_of_virgins/
Chad Vs Virgin,Virgin Vlad vs Chad DFV,2021-02-18,wallstreetbets,52575,775,0,https://reddit.com/r/wallstreetbets/comments/lmt3t8/virgin_vlad_vs_chad_dfv/
Chad Vs Virgin,Virgin conflict of interest vs chad nepotism,2020-10-20,WhitePeopleTwitter,49651,151,0,https://reddit.com/r/WhitePeopleTwitter/comments/jehb9x/virgin_conflict_of_interest_vs_chad_nepotism/
Chad Vs Virgin,Chad Walk.,2022-08-24,memes,47134,436,0,https://reddit.com/r/memes/comments/ww6l7o/chad_walk/
Chad Vs Virgin,virgin wonder woman vs chad captain america,2020-12-26,dankmemes,41114,275,0,https://reddit.com/r/dankmemes/comments/kksb34/virgin_wonder_woman_vs_chad_captain_america/
Chad Vs Virgin,Smol virgin Assassin's Creed poster vs Chad cyberpunk bus,2020-11-04,gaming,39059,687,0,https://reddit.com/r/gaming/comments/jnun3e/smol_virgin_assassins_creed_poster_vs_chad/
Chad Vs Virgin,Chad Hong Kong virgin Catalonia,2019-10-23,dankmemes,39004,393,0,https://reddit.com/r/dankmemes/comments/dlxd0e/chad_hong_kong_virgin_catalonia/
Chad Vs Virgin,Virgin pawn grew up to be a Chad Queen,2020-05-24,memes,38330,114,0,https://reddit.com/r/memes/comments/gppcgi/virgin_pawn_grew_up_to_be_a_chad_queen/
Chad Vs Virgin,Virgin Barby vs ChadTaro,2021-04-07,ShitPostCrusaders,37432,262,0,https://reddit.com/r/ShitPostCrusaders/comments/mm6u4g/virgin_barby_vs_chadtaro/
Chad Vs Virgin,the virgin student vs. the chad online reviewer,2021-05-15,dankmemes,36365,207,0,https://reddit.com/r/dankmemes/comments/ncvv9d/the_virgin_student_vs_the_chad_online_reviewer/
Chad Vs Virgin,chad guy is a virgin 😭😭,2021-10-18,shitposting,36082,888,0,https://reddit.com/r/shitposting/comments/qaq2or/chad_guy_is_a_virgin/
Chad Vs Virgin,Virgin conflict of interest vs chad nepotism,2020-10-21,facepalm,35308,677,0,https://reddit.com/r/facepalm/comments/jfd7x9/virgin_conflict_of_interest_vs_chad_nepotism/
Chad Vs Virgin,Virgin Meta Chasers vs Chad Fun Havers,2022-06-04,Eldenring,34828,1452,0,https://reddit.com/r/Eldenring/comments/v4js9i/virgin_meta_chasers_vs_chad_fun_havers/
Chad Vs Virgin,Basic guide to Wallstreetbets culture for Newcomers,2021-01-29,wallstreetbets,33426,1475,0,https://reddit.com/r/wallstreetbets/comments/l7fr21/basic_guide_to_wallstreetbets_culture_for/
Chad Vs Virgin,"Virgin and Chad, the great Opposites",2018-06-20,Bossfight,33376,455,0,https://reddit.com/r/Bossfight/comments/8sgu67/virgin_and_chad_the_great_opposites/
Chad Vs Virgin,🐝,2024-10-23,shitposting,31847,140,0,https://reddit.com/r/shitposting/comments/1gahqbm/_/
Chad Vs Virgin,the virgin wünderwaffen vs. the chad secret projects,2021-01-30,HistoryMemes,30728,318,0,https://reddit.com/r/HistoryMemes/comments/l8cmq8/the_virgin_wünderwaffen_vs_the_chad_secret/
Chad Vs Virgin,AITA for serving a pregnant woman a non-alcoholic cocktail?,2019-07-24,AmItheAsshole,30564,2685,0,https://reddit.com/r/AmItheAsshole/comments/ch3vqi/aita_for_serving_a_pregnant_woman_a_nonalcoholic/
Chad Vs Virgin,Anglo-Saxon Virgins were not pleased by the invasion of the Norse Chads,2020-11-02,HistoryMemes,30151,462,0,https://reddit.com/r/HistoryMemes/comments/jmsjbw/anglosaxon_virgins_were_not_pleased_by_the/
Chad Vs Virgin,The Virgin Great Depression banker vs Chad Farmers,2021-12-22,HistoryMemes,30026,453,0,https://reddit.com/r/HistoryMemes/comments/rmcj0f/the_virgin_great_depression_banker_vs_chad_farmers/
Chad Vs Virgin,Geography.,2022-08-29,antimeme,29937,77,0,https://reddit.com/r/antimeme/comments/x0oq27/geography/
Chad Vs Virgin,"The Chad Persians Vs The virgin Spartans. When you think about it, were the Spartans really the good guys",2021-12-17,HistoryMemes,29732,1021,0,https://reddit.com/r/HistoryMemes/comments/rifc6z/the_chad_persians_vs_the_virgin_spartans_when_you/
Chad Vs Virgin,Virgin Chad army,2021-01-29,memes,29423,192,0,https://reddit.com/r/memes/comments/l7jwkg/virgin_chad_army/
Chad Vs Virgin,The virgin facist Italy vs the chad Roman Empire,2020-05-23,HistoryMemes,28808,194,0,https://reddit.com/r/HistoryMemes/comments/gp0cwn/the_virgin_facist_italy_vs_the_chad_roman_empire/
Trollface,Allied bomber pilots be like: Problem? *trollface*,2020-10-01,okbuddyretard,10114,166,0,https://reddit.com/r/okbuddyretard/comments/j385cc/allied_bomber_pilots_be_like_problem_trollface/
Trollface,"My son is a ""Professional Gamer"" So he must get this for free!",2019-03-06,entitledparents,7181,564,0,https://reddit.com/r/entitledparents/comments/ay25rh/my_son_is_a_professional_gamer_so_he_must_get/
Trollface,[Terraria Modding] Likely mentally ill mod owner and their two alternate personas destroy their own mod with gross ERP and mismanagement,2020-09-10,HobbyDrama,1192,270,0,https://reddit.com/r/HobbyDrama/comments/iq3mti/terraria_modding_likely_mentally_ill_mod_owner/
Trollface,It's literally a dream....,2023-09-08,nothingeverhappens,1016,44,0,https://reddit.com/r/nothingeverhappens/comments/16dksid/its_literally_a_dream/
Trollface,genius idea 🧠,2026-03-12,ComedyNecrophilia,978,23,0,https://reddit.com/r/ComedyNecrophilia/comments/1rs2cws/genius_idea/
Trollface,"TIL the trollface meme ""(Problem?)"" is copyrighted. At the meme’s height, when it was plastered on t-shirts the creator would would pull in between $1",2017-08-27,todayilearned,895,18,0,https://reddit.com/r/todayilearned/comments/6wbu3f/til_the_trollface_meme_problem_is_copyrighted_at/
